{
  "version": "1.0.0",
  "support": { "slaRef": "support/sla.md", "runbookRef": "support/runbook.md", "owner": "Example Partner Support" },
  "source": { "repository": "https://github.com/example/testing-studio", "digest": "sha256:1111111111111111111111111111111111111111111111111111111111111111" },
  "services": [{ "minimumContractVersion": "v4", "id": "curate" }, { "minimumContractVersion": "v4", "id": "public-api" }],
  "schemaVersion": "eai.application-package.v1",
  "runtime": { "type": "isolated-hosted", "topology": "eai-hosted", "healthPath": "/health" },
  "routes": [{ "path": "/testing", "methods": ["GET"], "id": "testing.home" }],
  "publisher": { "kind": "partner", "id": "example-partner", "displayName": "Example Partner" },
  "packageId": "testing-studio",
  "objectTypes": [{ "slug": "test-run", "name": "TestRun", "manifestRef": "object-types/test-run.json" }],
  "manifestDigest": "sha256:3333333333333333333333333333333333333333333333333333333333333333",
  "lifecycle": { "updateRef": "lifecycle/update.json", "uninstallRef": "lifecycle/uninstall.json", "rollbackRef": "lifecycle/rollback.json", "migrationRef": "lifecycle/migrate.json", "installRef": "lifecycle/install.json" },
  "evidence": { "tenantIsolationRef": "evidence/tenant-isolation.json", "securityRef": "evidence/security.json", "ciRef": "evidence/ci.json", "accessibilityRef": "evidence/accessibility.json" },
  "distribution": { "visibility": "distributable" },
  "displayName": "Testing Studio",
  "dataGovernance": { "retentionDays": 30, "residency": ["AU"], "purposes": ["Application quality assurance"], "export": "none", "deletionPolicyRef": "legal/deletion.md", "classifications": ["internal", "personal"] },
  "compatibility": { "platformContract": "eai.app-marketplace/v1", "minimumTemplateVersion": "1.0.0" },
  "commercial": { "termsRef": "legal/terms.md", "model": "usage", "meterRef": "meters/test-run" },
  "capabilities": { "workload": ["audit.write", "test.execute"], "interactive": ["resource.read", "test.execute"], "contractVersion": "eai.app_capabilities.v1" },
  "callbacks": [{ "replayWindowSeconds": 120, "path": "/callbacks/test-complete", "idempotencyRequired": true, "id": "test-complete", "authMode": "signed-workload" }],
  "artifact": { "signatureRef": "evidence/signature.json", "sbomRef": "evidence/sbom.spdx.json", "repository": "ghcr.io/enterpriseaigroup/testing-studio", "provenanceRef": "evidence/provenance.json", "digest": "sha256:2222222222222222222222222222222222222222222222222222222222222222" },
  "appKey": "testing-studio"
}
